,评论,日期,评分,城市,昵称
0,完全不知道演什么，从来没看过这么差劲的片子～,2018/7/21,2.0,长沙,sealina_guo
1,"电影放了15分钟的时候。脱口而出：这太**姜文了。
别看故事，别考虑情节。就细细品味姜文的牛批就行了！
HIDDEN MAN 这英文表达更适合原著《b隐》",2018/7/21,4.5,北京,起什么昵称
2,姜文特有的那种在某些事的高调处理以及人物特写上，的确非常独特！不是一般人可以试出的烈酒！,2018/7/21,4.0,广州,浪雨257
3,很好啊 不错,2018/7/21,5.0,昆明,陈明881
4,无厘头的台词不味道，和《药神》没法比,2018/7/21,2.5,桐庐,丽珍928
5,好看，意犹未尽，反派干脆利落，惨烈的剧情却配了雄伟的交响乐，优美的享受着就看完了整部片子。,2018/7/21,5.0,晋中,LOST2631
6,片子真好，很明显的姜文节奏！给它9分，给10分怕姜文骄傲！,2018/7/21,4.5,包头,yCj689705576
7,喜欢姜文的可能喜欢，不喜欢这种表现方式的可能很不喜欢。,2018/7/21,4.0,北京,starlynch
8,和爸妈一起看的～可能智商不够吧，除了彭于晏的主线我对其他很多人物线都没太摸透。。,2018/7/21,4.0,安庆,梅梅酱0501
9,哎呦，不错呦,2018/7/21,5.0,天津,NpJ513534080
10,完全看不懂主线剧情，有点无厘头的黑色幽默,2018/7/21,1.5,贵阳,齐的隆冬强
11,跟不上21世纪电影的节奏了，回家，睡觉,2018/7/21,3.0,成都,ADC蛮王
12,说实话，笑点有点低,2018/7/21,2.5,廊坊,wVW460042600
13,懒得长篇大论 好看 18禁,2018/7/21,4.5,西安,好吃还是饺子
14,还可以，就是结局感觉不太完美??,2018/7/21,4.0,苏州,WST1759007364
15,比一般的套路电影还是精彩多了。,2018/7/21,4.5,深圳,NQK451955353
45,“蓝爸爸”这得很洗脑,2018/7/21,5.0,兰州,沈清欢99
104,还行吧！！！！,2018/7/21,4.5,兰州,udE830063077
119,不错！挺好看！,2018/7/21,5.0,阜宁,Krz192990611
149,给三分，其中***一分辛苦分，拍得可***太好了！70%的时间我都是黑人??逻辑呢？？呢？呢。,2018/7/21,0.5,贵阳,Qiakema
164,恶心……恶心……恶心……恶心……,2018/7/21,1.0,衢州,hng573037482
179,一b吊遭什么玩意,2018/7/21,2.5,南京,星空遥翰
194,挺好的，黑色幽默，讽刺有意思,2018/7/21,4.5,锦州,zEd140628946
209,满分，就是喜欢这么姜文的片子,2018/7/21,5.0,防城港,IPO44
269,动作戏比较好，剧情比较大众。,2018/7/21,1.5,长沙,周张智
284,期望越大失望越大，没有看到曾经的姜文。,2018/7/21,3.0,东莞,轻描淡写991
314,垃圾片，被评分骗了,2018/7/21,0.5,成都,PfZ261603640
344,一般般 啊哈哈 哈哈,2018/7/21,4.0,深圳,leeguanjun530
374,剧情扑朔迷离 姜文导演的特点发挥的淋漓尽致 故事没有结局,2018/7/21,5.0,南通,TUAN想NI爱
389,还行，肖斯塔科维奇很棒。,2018/7/21,4.5,亳州,jewel3223
404,嗯 很姜文 不大众,2018/7/21,3.0,北京,汇琰
419,严肃中带着幽默,2018/7/21,5.0,北京,MlA309826829
434,没大看懂！文化程度太底！,2018/7/21,1.0,湛江,wuyunsheng840
449,觉得不好看大概是因为看不懂里边的梗和讽刺点。学而时习之，不亦说乎,2018/7/21,5.0,包头,齐
464,乱七八糟 稀里糊涂 逻辑不明 叙事不清 跳梁小丑 靠彭于晏的脸和身材也撑不起这部电影,2018/7/21,0.5,开封,Ezzzzzi
659,??《邪不压正》~~不凡    痛快，震撼，节奏紧凑，不拖泥带水，直奔主题，男人的视角和纯爷们的个性展现，视听效果极具挑战性，演员阵容强大，内功深厚，剧情和人物融合的精彩到位，值得观赏！男人的视角看女人的妩媚，品女人的纯情，读女人的胸怀！男性的果敢和尊严超越了对事物表面的理解与表达，为了信念不惜一切代价，国仇家恨牢记心间，磨砺锤炼重拳出击，有勇有谋男人气概，悬念突起诱敌深入，驱除鞑虏为我中华，正邪对垒邪不压正！……影片暗藏创作者的个性特点，诙谐幽默，轻松愉快，冷笑话，抖包袱，暗藏其间，演员对所塑造的人物个性把握到位，纵观全剧影片整体风格独特，魅力十足！……??……,2018/7/21,5.0,哈尔滨,wdV142360566
689,真实，而且搞笑,2018/7/21,5.0,南京,SFk520451201
704,"有点看不懂意思
",2018/7/21,3.5,桃源,东50970
719,这是喜剧开玩笑的吧？？,2018/7/21,4.0,重庆,paa579003164
734,姜文。你到底会不会拍电影。血腥和垃圾脱节剧情和色情剧情还会什么。真的杀人和杀猪一样。别出来圈钱了。中国电影的悲哀。只会装大爷瞎拍！,2018/7/21,0.5,奉化,john2835
749,剧情有点深奥,2018/7/21,3.0,深圳,yOR838603366
764,]看r就看到天w地的 姜文又玩性之的。其影片的^p性很 人物^完整 但⑹律洗_有些跳S。w而言仍是^好的作品。,2018/7/21,4.0,珠海,帆wawa
779,这真是我看过最长的电影,2018/7/21,0.5,义乌,KWV948623544
794,非常之好看！,2018/7/21,4.5,郑州,一赛舍
854,超好看，彭于晏好帅,2018/7/21,5.0,太原,NvZ337402767
899,说不上来到底好不好看?? ，主要是没搞懂电影要表达什么,2018/7/21,4.0,广州,聚金
914,叙事有点乱。剧情，很多无厘头的地方。搞笑是可以的。但是总体上，还不够蒙太奇的高大上。,2018/7/21,3.5,南昌,缄默6629
1004,真的不好看??,2018/7/21,0.5,沭阳,neF668532086
1019,真心不怎么样，难道是我不懂艺术？,2018/7/21,2.5,上海,Eric小鬼
1049,完美，导演很姜文,2018/7/21,5.0,固原,vjE399195328
1064,看完电影感觉很一般，有点故弄玄虚过了，演员演技除外，,2018/7/21,1.5,南京,_weixin780885570
1079,没见过比这个还烂的片子,2018/7/21,0.5,常州,QBo23789863
1094,不好看不好看,2018/7/21,0.5,黄石,kws950604877
1289,还不错，剧情虽然单调了些,2018/7/21,5.0,长春,Lethe丶2333
1334,不错，很刺激，,2018/7/21,5.0,郑州,执笔、写过去
1349,彭于晏肉体好赞 剧情的话一般吧 不推荐跟小姑娘一起看除非小姑娘也喜欢看这种打斗的剧情,2018/7/21,3.5,广州,qbV336872511
1454,超级超级不好看,2018/7/21,0.5,北京,体贴儿
1484,还行吧，有点血腥，场面比较残忍,2018/7/21,3.5,靖江,FY985761690
1544,还好吧，凑合看。,2018/7/21,5.0,乌鲁木齐,念它成瘾
1574,还可以。笑点多,2018/7/21,4.0,郑州,流云0306
1589,还行吧，一个人杀两个人的故事。,2018/7/21,4.0,昆明,vivi的玻璃虫
1604,感觉有点偏向文字而缺乏吸引力，中途甚至有人离场,2018/7/21,3.0,昆明,jpj13708474805
1619,三部曲越来越下坡路,2018/7/21,2.5,贵阳,符号
1634,还可以。。。，,2018/7/21,4.5,北京,HaV430934195
1649,其实还算是比较清晰的讲了一个故事，而且细节挺值得回味。,2018/7/21,4.0,西安,rUy572567674
1664,姜文出品精品,2018/7/21,5.0,沙湾,ngL803579577
1694,姜文的电影，就是这种个性，看到很多人评价不好，可能是没认真看，回想一下姜文所有的电影，台词风格都是这套路。,2018/7/21,5.0,溧阳,行者浪迹天涯
1709,中间有一点点看不懂,2018/7/21,4.5,郑州,Vun676734019
1724,剧情乱七八糟，姜文**装大了，到后面圆不回来，只有自己被拔牙。里面穿插一些人物都不知道干嘛的，差，真差，7分都多了。,2018/7/21,1.5,孝感,阎伟238
1754,今天看的最难看的一部电影。浪费钱啊！,2018/7/21,0.5,桐乡,渐行的风
1769,感觉一般，不如让子弹飞,2018/7/21,3.5,长沙,叫我麦丁
1874,请问猫眼影评的评论员，你是良心评价吗？7.4？,2018/7/21,5.0,北京,ReN51840230
1889,算是喜剧片么？笑点多？,2018/7/21,3.5,沈阳,裂锦。114
1919,真的不咋滴哦,2018/7/21,2.0,丽江,Vpw514347972
2159,把个人英雄主义演的跟跳梁小丑也是没谁了,2018/7/21,0.5,北京,ky200019
2174,只能说比较一般,2018/7/21,2.5,上海,周鸣969
2189,还可以，故事一般,2018/7/21,4.0,北京,nof205629541
2204,本年度最烂的电影没有之一,2018/7/21,0.5,广州,ZOk810941424
2219,个人感觉很好看，并没有像别人说的看不懂，无论剧情还是制作，都很精良。值得一看。所以大家不要被其他人的观点误导啊～,2018/7/21,5.0,长治,小梁梁么啊
2234,许晴臀，于晏胸,2018/7/21,4.0,贵阳,QgN15757175079
2249,挺好看的，，,2018/7/21,5.0,泸州,xNd628588343
2279,真的真的好好看,2018/7/21,5.0,桐乡,prl125706457
2324,节奏快，厉害厉害,2018/7/21,4.5,上海,QEc135413986
2339,仰慕姜文导演的大作已久,2018/7/21,5.0,兰州,西北书城
2489,有点血腥，受不了,2018/7/21,2.5,襄城县,mqT351770462
2579,胡求扯！！！,2018/7/21,3.0,兰州,贝塔722
2594,电影挺好，但是什么破地方,2018/7/21,5.0,哈尔滨,fLG166370272
2609,还不错，台词很有感觉，开场比较血腥。,2018/7/21,4.0,芜湖,Cherry19840220
2624,剧情还可以吧,2018/7/21,4.0,江阴,听听听848
2639,剧情真是蠢死了，看得很尴尬。三分冲脸给,2018/7/21,1.5,瑞安,HgM195407961
2654,看似荒诞闹腾，实则发人深思,2018/7/21,4.5,新密,Ors491584283
2684,电影本身没什么，就是看着觉得有点枯燥,2018/7/21,3.0,长春,yujiachun7882
2714,好看，精彩极了,2018/7/21,5.0,运城,曾经最美8071
2744,还不错！！！,2018/7/21,4.0,上海,汪允昭
2759,巨难看 浪费钱 真真的,2018/7/21,1.0,莆田,rIp372352977
2774,"来看彭于晏的??
除了一些搞笑部分其余的很一般吧",2018/7/21,3.5,成都,end向日葵rui
2789,乱七不糟，糊里糊涂。,2018/7/21,1.0,大庆,TdJ214103125
2879,烂片，烂烂片,2018/7/21,0.5,郴州,Ofl306695578
2894,挺不错的电影，反映了当代社会的弊端。,2018/7/21,4.5,西安,sAj825568556
2939,一般般一般般,2018/7/21,2.5,上海,Plantreess
2984,不错！很好很好!,2018/7/21,5.0,沛县,晁哥哥
3269,演技不错，剧情散乱,2018/7/21,3.0,西宁,Zlg353481329
3299,隐喻和暗线太深，不怪评论里好多人骂。但是不认真看电影的也好多。值得十分,2018/7/21,5.0,西安,西风残照
3314,垃圾。。。。。。,2018/7/21,0.5,合肥,Piercetang34
3554,看不懂！要表达什么?,2018/7/21,2.5,珠海,ziX731019125
3629,中国人支持国货,2018/7/21,5.0,郑州,RcL428184021
3659,整部片子都在飘～有点太夸张了...,2018/7/21,4.0,北京,狐狸没成精
3704,好看，大家都来看,2018/7/21,5.0,遂宁,qeE528429429
3719,这个电影还是有情调的，有恐转喜，前面有点血腥，后面还蛮感人。,2018/7/21,4.0,长沙,酱紫
3734,姜文是鬼才，这才叫电影，期待下一个姜文的电影。,2018/7/21,5.0,烟台,pIu483795727
3749,真难看??????,2018/7/21,1.0,北京,ShI141922530
3764,还是报有很大希望的一部电影 结果还是挺失望的 中途超想离场 还是控制啦一下,2018/7/21,1.5,长春,Nip511948947
3779,"看不懂……以为自己能看懂的。就说说能看懂的吧。电影构图画面做得都不错，可是有时候背景音乐感觉不太适合
也许看懂了一点什么，可是仔细说又说不上来。
看懂了什么呢……到底什么是邪不压正？
是什么呢。",2018/7/21,3.5,徐州,今天也只能吃外卖
3854,最后结局看不懂，只感觉彭于晏这个角色好像没有什么智商一样,2018/7/21,4.0,武汉,xuwei5120
3884,棒棒哒??????,2018/7/21,5.0,呼和浩特,Myj1919666
3929,一般，就记得他在屋顶跳来跳去,2018/7/21,3.5,十堰,欧雨茜490
3944,故事情节曲折，值得推荐！,2018/7/21,5.0,临潼,另类12度
3959,与原著相差甚远。,2018/7/21,2.0,郑州,奥斯卡影帝
3974,我觉得没有什么好看的，连看电影的时候都有时候在吃鸡，建议小孩不要看，有一些少儿不宜的片段,2018/7/21,3.0,福州,wrc326304397
4214,天空视觉好美,2018/7/21,4.0,上海,hZC151369151
4229,营销满分，钱圈到了，影评就八个字：强行搞笑，最为致命！完全不知道在讲什么！,2018/7/21,0.5,兰州,agX616295946
4259,搞siao哈哈哈哈哈哈哈,2018/7/21,5.0,合肥,wMs954161873
4274,又一部姜文式,2018/7/21,4.0,泉州,qeuiozxcnm
4334,彭于晏 好看,2018/7/21,5.0,沂水,田鸡汤
4349,姜文的电影没让我失望，有水准，很好看。,2018/7/21,5.0,沈阳,陈艳5512
4454,这片只有7.3分，连动画片都比他高，近期影片最低分，大概是因为，姜文的电影是76度的白酒，一般人受不了,2018/7/21,5.0,温州,ameiayumi
4529,很久没看姜文的作品了，依然是子弹飞了的作派只是多了一些武打动作，王角功夫不错，看了笑笑而已，与近期上演的我不是药神差太远了??,2018/7/21,2.5,北京,ZMy608361609
4544,呵呵呵  开心开心,2018/7/21,5.0,璧山,过去还值得眷恋
4559,还不错吧，还是可以看的。,2018/7/21,4.0,平度,nvm178639127
4604,还可以，就是要回味,2018/7/21,4.5,岳阳,jsf741044827
4904,廖凡才是真影帝，文角儿武角儿，有廖凡演的角儿，一定是好角儿，有廖凡拍的电影，一定是好电影。,2018/7/21,5.0,广州,失去
5129,浪费了彭于晏这样好的演员，题材不错，内容太差,2018/7/21,1.5,贵阳,ZNj845062979
5219,逻辑不明的电影,2018/7/21,0.5,南宁,现充boy（笑
5729,面很美 彭不m合@角色,2018/7/21,4.0,深圳,HtL45156795
5744,近几年，姜导改走荒诞路线了吗？,2018/7/21,3.0,哈尔滨,老神驾到
5759,原来评分低是有原因的，真的不好,2018/7/21,0.5,武汉,huao123
5774,除了房顶没别的玩意儿了,2018/7/21,3.5,中山,怎么说话NE
5789,后面剧情有点乱了,2018/7/21,4.0,江都,前行480
5819,好性感的许晴，可她却不是女，女1还是二婚，配彭于晏有点赚了,2018/7/21,5.0,东兴,Rho996051232
5999,姜文一贯作风！空洞的故事情节硬插入历史背景里 想搞点高姿态的艺术 想说的说不清楚 想叛逆又没这胆子！所以拉着一群老百姓给他捧票房 看不懂的大可以骂做无知。彭于晏炸鸦片房的桥段和手撕鬼子也差不多…周围看不下去提前退场的比比皆是 浪费我的钱也就罢了 再浪费我的时间那可亏大了！,2018/7/21,1.5,南京,lew524423638
6014,确实有意思，哈哈,2018/7/21,5.0,石家庄,叻陶
6029,太喜欢姜文。太喜欢彭于晏了。,2018/7/21,5.0,醴陵,wvQ31300624
6044,这部电影不错,2018/7/21,4.5,宜兴,utW963660651
6104,很姜文，很燃，很爆炸，喜欢到爆。,2018/7/21,5.0,沈阳,UMW929851747
6119,有生之年看过最垃圾的一部电影，没有之一。,2018/7/21,0.5,宿州,abcd0415
6134,看半天也看不出什么，是我没看出内涵嘛,2018/7/21,3.0,海口,t112008312
6149,剧情一般，最后感觉傻乎乎的有点,2018/7/21,3.0,杭州,戚金龙97
6164,不喜欢就是不喜欢啊,2018/7/21,0.5,日照,koK590499788
6179,演技不错的 朋友觉得很喜欢,2018/7/21,3.5,哈尔滨,dBV933724998
6209,延续了姜文一贯的风格，粗狂，野性，肌肉，充满男性荷尔蒙。但是故事讲的不清不楚，不知道想表达什么。电影中呈现的北京旧城非常美。,2018/7/21,3.0,北京,love727
6224,影片可以，很姜文！,2018/7/21,5.0,天门,ocd747124605
6239,还行吧。。。。。,2018/7/21,4.0,重庆,VUh984212522
6254,现在的导演太没有道德底线了，看完不知道是什么意思，建议不要看,2018/7/21,0.5,泰州,JiC626384353
6299,好看吗？好看吗？好看吗？一般吧！,2018/7/21,4.0,鞍山,qqpp9966
6314,姜文导的电影从来没有让我失望过,2018/7/21,5.0,深圳,qxL479321192
6329,"感觉想模仿昆汀，然而功力太差
真的看到一半就想走了，观感实在差
虽然开头，配乐，场景，摄影还不错
说好看的是真的吗，黑色幽默，暴力美学拍成这样，拍成观众一脸懵逼的样子，真的是导演的问题",2018/7/21,1.0,大丰,Gcf694367351
6344,朱一龙推荐的肯定好看，少有的良心剧,2018/7/21,5.0,湘西,天官赐福
6359,还行，期待下部能更好,2018/7/21,3.5,汕头,吃喝玩乐201357
6374,好看好看真好看,2018/7/21,4.5,兰州,小丐片
7169,竟无语凝噎。剧情没有好好铺垫，人物间的感情、对话总感觉刻意而突兀，甚至说实话，跟平板型人物没什么差别。影片的处理也不好，特效可以不要，但拍摄的技巧可以再打磨打磨，让我代入一会会儿吧。,2018/7/21,1.0,大丰,赫连涅尘
7214,一家人看的还可以,2018/7/21,4.5,绥中,dream莹
7274,好看，超想看的,2018/7/21,5.0,绵阳,莫奈268
7289,姜文出品必属精品,2018/7/21,5.0,北京,wiG785061675
7319,比较失望，没有预想的那么好看。,2018/7/21,3.5,宜昌,坡花
7349,很失望，影片严重断片，演员也演得了了,2018/7/21,0.5,金华,STI347537123
7364,彭于晏超级帅！,2018/7/21,5.0,玉溪,全金属雪糕。
7379,彭于晏好帅，演技也好，电影内容蛮深刻的，推荐,2018/7/21,5.0,包头,已经饿扁啦
7394,挺好看，有点血腥，刺激，后面有点看不懂了。,2018/7/21,4.0,昆山,efV707658779
7409,没意思  姜大爷  你想说什么啊 真心的累,2018/7/21,0.5,西安,SOh112534257
7424,光电影而言可以说精彩,2018/7/21,3.5,上海,卫伟8012
7469,主要看彭于晏去了，剧情一般,2018/7/21,5.0,贵阳,EasonCCCCCCC
7619,挺好的，很喜欢,2018/7/21,5.0,济宁,依依0043
7709,可能是我比较low，完全看不懂（＃－.－）,2018/7/21,2.5,景德镇,BSW151
7724,体现不出什么意义，没看明白想表达啥,2018/7/21,3.5,沈阳,燕子90584
7754,看到最后没看出啥东西,2018/7/21,3.5,合肥,mYd988592335
7769,故事很不错。,2018/7/21,4.0,昆明,Dwl710052596
7844,为了商业妥协 反而不如一步之遥 ,2018/7/21,4.0,天津,大天使8196
7859,还可以吧，可看,2018/7/21,4.0,大连,佳大业大
7889,好好嗯今天天气冷总,2018/7/21,5.0,深圳,yuanyong114
7904,还好 仅限于还好,2018/7/21,3.0,哈尔滨,sharpppp2
7919,很好，值得推荐，小朋友看可能会有些害怕,2018/7/21,5.0,武汉,根本不知道起啥名
7934,讽刺意味满满，总是能戳中我的笑点。就是演员语速太快了，也可能是我反应速度慢，有很多点还没来得及细细品味就过去了。哈哈哈没事儿的时候再来看看,2018/7/21,4.5,哈尔滨,无澜
7994,又黄又暴力节奏还快 可以去看惊喜死你,2018/7/21,5.0,商丘,dJz737488664
8054,不愧是影帝的杰作,2018/7/21,4.5,北京,何飞
8084,一般般。。。。。,2018/7/21,3.5,阜阳,wl13966808000
8114,姜文我拜托你不要再拍电影了,2018/7/21,0.5,成都,关谷2012
8174,我静静妹妹,2018/7/21,4.0,襄阳,w柏伍岑
8234,期望过高带来的就是失望,2018/7/21,3.0,宜昌,J
8249,真的是超级超级烂！超级超级！大家别看了！省点儿钱 干啥不好！！,2018/7/21,0.5,沈阳,evachen83
8309,还行吧，就是没看明白，,2018/7/21,3.5,盘锦,pTL154643672
8474,导演脑子坏掉了，浪费钱和别人的时间,2018/7/21,2.0,西安,王成857
8894,很好看！彭于晏好帅,2018/7/21,5.0,徐州,dwL810654280
8909,曲美影酷人靓,2018/7/21,5.0,厦门,Spd424496063
8924,一般没看头，单纯的冲彭于晏去看的,2018/7/21,1.5,南阳,SJQ511866565
8939,很有姜文的风格,2018/7/21,4.5,天津,飞蛾扑火
8969,比较凌乱，没有主题故事线路,2018/7/21,2.5,北京,NASDAQ154
9074,北平的天空真精彩,2018/7/21,3.5,重庆,hHM744501878
9104,就是一个简单的事情，文哥整的好复杂,2018/7/21,3.5,上海,uor154885367
9134,还不错，姜文导演的准没错,2018/7/21,5.0,武汉,Usj597436066
9254,8分是给姜文的，但是原来越看不懂了，要不是我们肤浅了,2018/7/21,4.0,柳州,魁哥
9284,没有让子弹飞好看,2018/7/21,3.5,临汾,李小云0008
9539,"看过《雪国》吗
我猜那个雪就像北平街头那么美
好喜欢周韵好喜欢许晴啊ε??(??> ?? <)?? з",2018/7/21,4.5,绍兴,啾啾0904
9569,彭于晏一如既往的帅,2018/7/21,2.5,红河,f易燃易爆
9584,不会写好电影,2018/7/21,5.0,章丘,突击攻坚
9599,有点看不懂。。,2018/7/21,4.5,临沂,蕴涵爱猫
9689,彭于晏真帅耶,2018/7/21,4.0,泉州,sEc814948790
9704,彭于晏luoshen，亮眼睛，第一次这么放的开,2018/7/21,4.0,连江,Eric30
9734,为了彭于晏去看的。连彭于晏都拯救不了的电影，像看了一场话剧。,2018/7/21,0.5,武汉,mvD13971443339
9929,无聊，要睡了！,2018/7/21,0.5,上海,TQJ598584399
9944,除了男神耍帅，无剧情,2018/7/21,1.5,伊宁,Bzhenq爱zhoumeny
10004,感觉一般，不是那么喜欢。,2018/7/21,1.5,重庆,ppT850899530
10019,挺好看的，哈哈哈,2018/7/21,5.0,梅河口,总有逗比调戏我
10034,黄色电影我喜欢,2018/7/21,5.0,南京,OPi936763135
10049,虽然改掉了语无伦次，但毕竟姜文还是老了,2018/7/21,3.5,郑州,老实人一个849
10064,跌宕起伏的剧情，节奏很紧凑，四位主演有演技有颜值，值得推荐,2018/7/21,4.0,北京,e35400
10079,有笑点，比较搞笑，情节一般,2018/7/21,4.5,郑州,哈哈冯李李
10094,额，我没看懂，我看睡着了,2018/7/21,4.0,驻马店,李白他二伯
10109,好看好看好看,2018/7/21,5.0,岳阳,tb2655
10139,一般般，soso,2018/7/21,3.0,台州,莎莎1994
10184,孩子去看的据说还行！,2018/7/21,4.0,合肥,李育松503
10214,制作讲究，演绎精彩！,2018/7/21,3.0,襄阳,忘m326639088
10259,这是我十年看过最烂的电影，没有之一。,2018/7/21,0.5,呼和浩特,KWX821
10274,一般。。。。。,2018/7/21,3.0,哈尔滨,QbS738956364
10364,没有想象中的好，但也有它独特的意味。,2018/7/21,3.0,高邮,iIT355342105
10394,个人觉得 除了姜文的演技之外 彭于晏和父亲的对话就像念台词一样 行动就像一个不知道他想干什么的疯子 邪不胜正也没看出来哪里不胜正 电影看的有点打瞌睡给个一分给姜文一分给标题,2018/7/21,1.0,本溪,taB501057596
10409,远比想象中差距太远～觉得浪费了这好几个硬汉表演，很失望。,2018/7/21,3.0,石家庄,Hey许久不见
10424,一般吧，本来就是冲着彭于晏去看的，其他的就那样,2018/7/21,2.5,无为,空巢仙女人土土
10604,太烂了，太烂了,2018/7/21,0.5,海口,rdp895360503
10619,影片缺少感觉,2018/7/21,2.5,开封,王一名784
10634,为了彭于晏的奔跑去看电影的！,2018/7/21,4.5,石河子,心盲眼盲229
10664,姜文试的表达，电影节奏。能量点多，而且分散。不是那个年代的人，或知识面窄，里边就会有很多点，get不到,2018/7/21,4.0,新乡,NIF740346059
10754,强烈要求总局把影片分级，见到还有家长带小朋友来看的。,2018/7/21,5.0,东莞,gfj783055186
10814,我女朋友说整部片子她完全看不懂，她说她单纯只是为了他的美貌才看完整场，哎。。。赞,2018/7/21,3.5,上海,满天飞雪
10919,不行啊，叙事太差劲,2018/7/21,1.5,保山,KuT450480672
10934,不用说什么了，满分敬上,2018/7/21,5.0,金华,_qqhzn1389168908
10979,儿子说不怎么样,2018/7/21,3.5,无锡,姚陈意一
10994,非常烂的片子,2018/7/21,0.5,武汉,xuE261278944
11009,特别姜文的一部电影，我真的不知道如何评价剧情，只记得出各种充满个人色彩的表达方式。,2018/7/21,4.0,广州,Ugv948078329
11024,大概是我这个观众不行吧。除了小脚放足跨过贞节牌坊那个桥段有感触，其余全程在匪夷所思。,2018/7/21,3.0,深圳,堂堂夜小末
11039,很好啊！挺喜欢,2018/7/21,4.0,肥城,iIz952141663
11054,没看懂太深的意义，没什么意思都睡着了……全程就靠彭于晏的好身材了……,2018/7/21,2.5,长春,NhF933495792
11264,"《邪不压正》――典型的姜文电影（看得懂的人喜欢，看不懂的人想睡觉）
姜文式的幽默会让相对压抑的电影有了一丝缓和。剧情的推进相对紧凑，演员的台词是典型的姜文式风格，加上BGM让人感觉像西方的歌剧或者舞台剧。廖凡和姜文的演技真的厉害，廖凡的可塑性太强了，演啥都像。至于彭于晏，颜值和身材真的没话说，但是他的台湾口音始终让我有点出戏，说不说北京人的感觉，而且他很多戏份像在房顶跑酷。
剧情的后半段比前半段更加精彩，总的来说，姜文的电影更多的是展现他想要的东西，很多人看不懂他的电影，或许可以认知为“属于姜文自己的艺术”吧。个人觉得，这本电影，可以看一下，不过或许会睡着[捂脸]。《让子弹飞》可能更加好看一点",2018/7/21,3.5,武汉,Tracy28809
11294,一如既往，痴人说梦,2018/7/21,5.0,深圳,Ptz101113462
11309,不好看，都睡着了……,2018/7/21,2.5,常州,yuan602627031
11384,真难看，像一群傻子，不知道在干嘛，千万别看,2018/7/21,0.5,石家庄,bnh144283649
11399,很好看，感受很深，冲男了力量，荷尔蒙爆发,2018/7/21,5.0,淮安,小美盼子
11429,超级难看 都要睡着了,2018/7/21,0.5,宜昌,Sns755856860
11459,这拍的什么烂东西，姜文还是天分差点。。。,2018/7/21,1.5,岳阳,你香香
11519,说个叼，**根本看不懂，我是看了个假电影吗？,2018/7/21,5.0,汕头,MT在上
11549,还行吧，完全来舔彭于晏的颜,2018/7/21,2.5,东莞,eWk873872843
11594,不错的不错的不错的,2018/7/21,5.0,济宁,xky314172872
11609,语言风趣幽默，剧情稍微偏于简单，挺让人放松愉快的。,2018/7/21,4.0,南京,天地浩瀚1998
11624,有二就更好了,2018/7/21,3.5,庆阳,Ymp724482228
11804,很酷啊 呵呵呵,2018/7/21,3.5,北京,good8movie
11819,喜欢关巧红，因为她是为一个让彭于晏心动的人,2018/7/21,5.0,汕头,波妞299
11834,..好.....,2018/7/21,5.0,诸暨,野性藏於性
